{
  "schema": "retention-manifest/v1",
  "artifact_root": "<artifact-root>",
  "generated_at": "<timestamp-utc>",
  "retention_classes": [
    { "id": "retain_long_term", "meaning": "keep indefinitely" },
    { "id": "retain_until_manual_archive_window", "meaning": "keep until an operator-run archive pass" },
    { "id": "safe_to_prune_now", "meaning": "no remaining obligation" },
    { "id": "optional_cold_archive_only", "meaning": "not needed live; archive if convenient" }
  ],
  "policy": {
    "dry_run_by_default": true,
    "apply_requires_explicit_flag": true,
    "keep_newest": 5,
    "minimum_age_days": 14,
    "protected_when_referenced_as_rollback": true,
    "never_deletes_outside_artifact_root": true,
    "never_restarts_services": true,
    "admitted_producer_families_only": true
  },
  "artifacts": [
    {
      "artifact_id": "artifact-0000",
      "path": "<artifact-root>/run-0000/",
      "run_id": "run-0000",
      "producer": "durable-lane worker entrypoint",
      "source_identity": {
        "surface_slug": "example-project",
        "canonical_root": "<projects-root>/example-project",
        "branch": "task/example-project-build-validation",
        "commit": "a1b2c3d4"
      },
      "target_identity": "the build script of example-project and its local test suite",
      "evidence_freshness": { "observed_at": "<timestamp-utc>", "freshness_class": "stable" },
      "acceptance_predicate": "the validation step fails the build on a missing required field and passes when it is present",
      "authority_class": "authoritative",
      "retention_class": "retain_long_term",
      "referenced_as_rollback": false
    },
    {
      "artifact_id": "artifact-0001",
      "path": "<artifact-root>/promotions/op-0000/",
      "run_id": "op-0000",
      "producer": "runtime promotion coordinator",
      "source_identity": {
        "surface_slug": "example-runtime",
        "canonical_root": "<projects-root>/example-runtime",
        "branch": "main",
        "commit": "a1b2c3d4"
      },
      "target_identity": "<release-id>",
      "evidence_freshness": { "observed_at": "<timestamp-utc>", "freshness_class": "stable" },
      "acceptance_predicate": "every enumerated persisted and live identity surface resolves to the promoted release and every zero-difference gate reports zero differing rows",
      "authority_class": "authoritative",
      "retention_class": "retain_until_manual_archive_window",
      "referenced_as_rollback": true
    },
    {
      "artifact_id": "artifact-0002",
      "path": "<artifact-root>/capability-validation-runs/run-0002/",
      "run_id": "run-0002",
      "producer": "read-only capability validation runner",
      "source_identity": {
        "surface_slug": "example-control-plane",
        "canonical_root": "<workspace-root>",
        "branch": "main",
        "commit": "b2c3d4e5"
      },
      "target_identity": "every declared integration route and its readiness probe",
      "evidence_freshness": { "observed_at": "<timestamp-utc>", "freshness_class": "volatile" },
      "acceptance_predicate": "each registered route has a passing readiness probe",
      "authority_class": "generated",
      "retention_class": "optional_cold_archive_only",
      "referenced_as_rollback": false
    },
    {
      "artifact_id": "artifact-0003",
      "path": "<artifact-root>/run-0003/",
      "run_id": "run-0003",
      "producer": "durable-lane worker entrypoint",
      "source_identity": {
        "surface_slug": "example-project",
        "canonical_root": "<projects-root>/example-project",
        "branch": "task/example-project-scratch-check",
        "commit": "c3d4e5f6"
      },
      "target_identity": "a superseded local check with no downstream reference",
      "evidence_freshness": { "observed_at": "<timestamp-utc>", "freshness_class": "stable" },
      "acceptance_predicate": "none outstanding; the lane terminalized as superseded",
      "authority_class": "historical",
      "retention_class": "safe_to_prune_now",
      "referenced_as_rollback": false
    }
  ],
  "note": "Retention class records storage intent only. It never grants source authority, never makes an artifact part of the live source-of-truth path, and never overrides the current registry."
}
